{
  "$schema": "https://json-schema.org/draft/2020-12/schema",
  "title": "Presentation",
  "type": "object",
  "required": ["title", "slides"],
  "properties": {
    "title": {"type": "string"},
    "subtitle": {"type": "string"},
    "audience": {"type": "string"},
    "goal": {"type": "string"},
    "slides": {
      "type": "array",
      "minItems": 1,
      "items": {
        "type": "object",
        "required": ["id", "title", "key_message", "content"],
        "properties": {
          "id": {"type": "string"},
          "title": {"type": "string"},
          "key_message": {"type": "string"},
          "content": {"type": "array", "items": {"type": "string"}},
          "visual": {"type": "string"},
          "speaker_notes": {"type": "string"},
          "sources": {"type": "array", "items": {"type": "string"}}
        }
      }
    }
  }
}
