{
  "title": "Prompt'tan Sunuma",
  "subtitle": "Ham girdileri sunuma hazır çıktılara dönüştüren modüler yapay zeka iş akışı",
  "audience": "Teknik ve iş paydaşları",
  "goal": "Sunum otomasyonu mimarisini göstermek",
  "slides": [
    {
      "id": "01",
      "title": "Sunum üretimi tek bir prompt değil, bir iş akışıdır",
      "key_message": "Araştırma, anlatı, kalite güvencesi ve PPTX üretimini ayrı aşamalara bölmek iş akışını daha kontrol edilebilir hale getirir.",
      "content": [
        "Girdiler konu, not veya yapılandırılmış verilerden gelebilir",
        "Yapay zeka yapılandırılmış sunum verisi üretir",
        "Deterministik PPTX motoru düzenlenebilir PowerPoint dosyasını oluşturur",
        "QA (Kalite Güvencesi) ayrı bir kontrol adımı olarak çalışır"
      ],
      "visual": "Yatay iş akışı: Girdi → Skill'ler → QA → JSON → PPTX",
      "speaker_notes": "Modüler bir iş akışının hata ayıklamayı ve sistemi geliştirmeyi neden kolaylaştırdığını açıklayın.",
      "sources": []
    },
    {
      "id": "02",
      "title": "Skill'ler görevleri, workflow'lar çalışma sırasını tanımlar",
      "key_message": "Yeniden kullanılabilir skill'ler sunum üretim kurallarını orkestrasyon mantığından bağımsız tutar.",
      "content": [
        "Araştırma Skill'i bir kanıt haritası oluşturur",
        "Sunum Skill'i anlatı yapısını ve slaytları oluşturur",
        "Doküman Skill'i uzun içerikleri yapılandırılmış sunum girdisine dönüştürür",
        "QA Skill'i yapısal ve içerik sorunlarını tespit eder"
      ],
      "visual": "Orkestrasyon katmanına bağlı dört modüler skill kartı",
      "speaker_notes": "Skill tanımları ile yürütme akışının birbirinden ayrılmasının önemini vurgulayın.",
      "sources": []
    },
    {
      "id": "03",
      "title": "Yapılandırılmış JSON, yapay zeka ile PowerPoint arasındaki sözleşmedir",
      "key_message": "Model slaytları doğrudan değiştirmez; doğrulanabilir ve yapılandırılmış veri üretir.",
      "content": [
        "Her slayt için öngörülebilir alanlar kullanılır",
        "PPTX üretiminden önce JSON doğrulaması yapılır",
        "Prompt'lar değiştirilmeden PPTX motoru geliştirilebilir",
        "PPTX kodu değiştirilmeden model sağlayıcısı değiştirilebilir"
      ],
      "visual": "Yapay zeka → Yapılandırılmış JSON → PPTX",
      "speaker_notes": "JSON Schema'nın sistem bileşenleri arasında bir veri sözleşmesi görevi gördüğünü açıklayın.",
      "sources": []
    },
    {
      "id": "04",
      "title": "Demo, ücretli bir yapay zeka API'si olmadan çalışır",
      "key_message": "Deterministik demo, PPTX motorunun herhangi bir yapay zeka sağlayıcısına ihtiyaç duymadan çalışabildiğini gösterir.",
      "content": [
        "python app.py --demo komutu çalıştırılır",
        "Örnek sunum JSON'u doğrulanır",
        "Düzenlenebilir bir .pptx dosyası oluşturulur",
        "Yerel Ollama modeli ayrı olarak etkinleştirilebilir"
      ],
      "visual": "Demo akışı: Komut → JSON doğrulama → düzenlenebilir PPTX",
      "speaker_notes": "Deponun kolayca test edilebilmesi için demonun ücretli bir yapay zeka API'sine ihtiyaç duymadığını açıklayın.",
      "sources": []
    },
    {
      "id": "05",
      "title": "Yerel yapay zeka, mimariyi model sağlayıcısından bağımsız tutar",
      "key_message": "Ollama sunum JSON'unu yerel olarak üretirken iş akışının geri kalanı aynı şekilde çalışmaya devam eder.",
      "content": [
        "Yerel model Sunum Skill'ini kullanır",
        "Modelden yalnızca yapılandırılmış JSON çıktısı istenir",
        "Şema doğrulaması hatalı çıktıları yakalar",
        "Aynı PPTX motoru nihai PowerPoint dosyasını üretir"
      ],
      "visual": "Ollama → JSON doğrulayıcı → PPTX motoru",
      "speaker_notes": "Model çıktısının değişebileceğini ve doğrulama katmanının bu nedenle önemli olduğunu açıklayın.",
      "sources": []
    },
    {
      "id": "06",
      "title": "Sonraki geliştirme alanı: daha zengin doküman girdileri",
      "key_message": "Mimari, gelecekte PDF, DOCX ve URL adaptörlerinin iş akışına eklenebileceği şekilde genişletilebilir olarak tasarlanmıştır.",
      "content": [
        "Planlanan PDF metin ve tablo çıkarma adaptörü",
        "Planlanan DOCX bölüm bazlı ayrıştırma adaptörü",
        "Planlanan URL içerik normalizasyonu ve kaynak takibi",
        "Planlanan kaynak düzeyinde atıf takibi"
      ],
      "visual": "Planlanan girdiler: PDF + DOCX + URL → normalize edilmiş kanıt verisi",
      "speaker_notes": "Bu adaptörlerin tamamlanmış v1 özellikleri değil, sonraki geliştirme adımları olduğunu özellikle belirtin.",
      "sources": []
    }
  ]
}
